{
  "schema_version": "facts_snapshot.v0",
  "case_id": "D-B01",
  "session_id": "D-B01-S01-generated",
  "facts": [
    {
      "fact_id": "fact-001",
      "category": "timeline",
      "statement": "Both parents are in a cooperative separation and are working toward a logistics coordination framework.",
      "status": "accepted",
      "source_turns": [
        1
      ],
      "related_issues": [
        "parenting_schedule",
        "communication_protocol"
      ],
      "note": null
    },
    {
      "fact_id": "fact-002",
      "category": "communication_history",
      "statement": "The current absence of a logistics framework is creating friction and confusion for both parents and the child.",
      "status": "accepted",
      "source_turns": [
        2
      ],
      "related_issues": [
        "communication_protocol",
        "parenting_schedule"
      ],
      "note": null
    },
    {
      "fact_id": "fact-003",
      "category": "family_structure",
      "statement": "Both parents share an interest in the child's comfort and a workable co-parenting logistics process.",
      "status": "accepted",
      "source_turns": [
        3
      ],
      "related_issues": [
        "parenting_schedule",
        "communication_protocol"
      ],
      "note": null
    },
    {
      "fact_id": "fact-004",
      "category": "communication_history",
      "statement": "The parents differ in whether written structure or mutual flexibility should be the primary framing.",
      "status": "accepted",
      "source_turns": [
        3
      ],
      "related_issues": [
        "communication_protocol"
      ],
      "note": null
    },
    {
      "fact_id": "fact-005",
      "category": "family_structure",
      "statement": "Both parents identify child comfort as the common anchor for any logistics framework.",
      "status": "accepted",
      "source_turns": [
        4
      ],
      "related_issues": [
        "parenting_schedule",
        "activity_coordination"
      ],
      "note": null
    },
    {
      "fact_id": "fact-006",
      "category": "communication_history",
      "statement": "Both parents accept that a default-guide framing can satisfy both the clarity need and the flexibility need.",
      "status": "accepted",
      "source_turns": [
        5
      ],
      "related_issues": [
        "communication_protocol"
      ],
      "note": null
    }
  ],
  "facts_notes": "Facts remain separated from unresolved feasibility questions."
}
