{
  "schema_version": "facts_snapshot.v0",
  "case_id": "D-B09",
  "session_id": "D-B09-S02",
  "facts": [
    {
      "fact_id": "fact-001",
      "category": "communication_history",
      "statement": "No issue content has been introduced \u2014 domain family unknown",
      "status": "accepted",
      "source_turns": [
        1
      ],
      "related_issues": [
        "parenting_schedule"
      ],
      "note": null
    },
    {
      "fact_id": "fact-002",
      "category": "communication_history",
      "statement": "No positions or concerns articulated by either party",
      "status": "accepted",
      "source_turns": [
        1
      ],
      "related_issues": [
        "parenting_schedule"
      ],
      "note": null
    },
    {
      "fact_id": "fact-003",
      "category": "timeline",
      "statement": "One parent explicitly describes the schedule, school, therapy, and reimbursement questions as tightly coupled rather than separable.",
      "status": "accepted",
      "source_turns": [
        2
      ],
      "related_issues": [
        "parenting_schedule",
        "school_logistics",
        "child_expense_coordination"
      ],
      "note": null
    },
    {
      "fact_id": "fact-004",
      "category": "communication_history",
      "statement": "Only Party A has spoken \u2014 Party B's perspective is a complete unknown",
      "status": "accepted",
      "source_turns": [
        3
      ],
      "related_issues": [
        "parenting_schedule"
      ],
      "note": null
    },
    {
      "fact_id": "fact-005",
      "category": "communication_history",
      "statement": "Party A's four-issue coupled frame is a hypothesis, not established fact",
      "status": "accepted",
      "source_turns": [
        3
      ],
      "related_issues": [
        "parenting_schedule"
      ],
      "note": null
    },
    {
      "fact_id": "fact-006",
      "category": "timeline",
      "statement": "The linked decisions still depend on outside calendars, transport feasibility, and reimbursement expectations that have not been jointly stabilized.",
      "status": "uncertain",
      "source_turns": [
        4
      ],
      "related_issues": [
        "parenting_schedule",
        "school_logistics",
        "child_expense_coordination",
        "communication_protocol"
      ],
      "note": "The session surfaced these items as unresolved rather than settled."
    },
    {
      "fact_id": "fact-007",
      "category": "communication_history",
      "statement": "Participation equity is a precondition for procedural fairness \u2014 Party B has not had equal opportunity to define the problem",
      "status": "accepted",
      "source_turns": [
        5
      ],
      "related_issues": [
        "parenting_schedule"
      ],
      "note": null
    },
    {
      "fact_id": "fact-008",
      "category": "communication_history",
      "statement": "Any option set built only on Party A's framing risks entrenching power imbalance",
      "status": "accepted",
      "source_turns": [
        5
      ],
      "related_issues": [
        "parenting_schedule"
      ],
      "note": null
    }
  ],
  "facts_notes": "Uncertain feasibility items remain explicit rather than being promoted to settled conclusions."
}
