{
  "schema_version": "facts_snapshot.v0",
  "case_id": "D-B04",
  "session_id": "D-B04-S02",
  "facts": [
    {
      "fact_id": "fact-001",
      "category": "communication_history",
      "statement": "No domain-specific information yet gathered",
      "status": "accepted",
      "source_turns": [
        1
      ],
      "related_issues": [
        "parenting_schedule"
      ],
      "note": null
    },
    {
      "fact_id": "fact-002",
      "category": "communication_history",
      "statement": "Case identifier suggests standard divorce/separation mediation context",
      "status": "accepted",
      "source_turns": [
        1
      ],
      "related_issues": [
        "parenting_schedule"
      ],
      "note": null
    },
    {
      "fact_id": "fact-003",
      "category": "parenting_schedule",
      "statement": "There is an active dispute about school-night overnights.",
      "status": "accepted",
      "source_turns": [
        2
      ],
      "related_issues": [
        "parenting_schedule"
      ],
      "note": null
    },
    {
      "fact_id": "fact-004",
      "category": "family_structure",
      "statement": "The child has school-related routine needs that both parents recognize as important.",
      "status": "accepted",
      "source_turns": [
        2
      ],
      "related_issues": [
        "parenting_schedule",
        "school_logistics"
      ],
      "note": null
    },
    {
      "fact_id": "fact-005",
      "category": "communication_history",
      "statement": "Child's school schedule creates temporal structure",
      "status": "accepted",
      "source_turns": [
        3
      ],
      "related_issues": [
        "parenting_schedule"
      ],
      "note": null
    },
    {
      "fact_id": "fact-006",
      "category": "communication_history",
      "statement": "Transportation logistics appear to be a material concern",
      "status": "accepted",
      "source_turns": [
        3
      ],
      "related_issues": [
        "parenting_schedule"
      ],
      "note": null
    },
    {
      "fact_id": "fact-007",
      "category": "family_structure",
      "statement": "Parent B links school-week overnights to meaningful parenting-role concerns.",
      "status": "accepted",
      "source_turns": [
        4
      ],
      "related_issues": [
        "fairness_and_parent_role",
        "parenting_schedule"
      ],
      "note": "Accepted as a stated process-relevant concern, not as an adjudicated conclusion about intent."
    },
    {
      "fact_id": "fact-008",
      "category": "communication_history",
      "statement": "School schedule creates natural temporal structure",
      "status": "accepted",
      "source_turns": [
        5
      ],
      "related_issues": [
        "parenting_schedule"
      ],
      "note": null
    },
    {
      "fact_id": "fact-009",
      "category": "communication_history",
      "statement": "Transportation logistics are real constraints, not just rhetorical",
      "status": "accepted",
      "source_turns": [
        5
      ],
      "related_issues": [
        "parenting_schedule"
      ],
      "note": null
    },
    {
      "fact_id": "fact-010",
      "category": "timeline",
      "statement": "Transport, exchange timing, and homework-routine reliability remain unresolved for school-week overnights.",
      "status": "uncertain",
      "source_turns": [
        6
      ],
      "related_issues": [
        "school_logistics",
        "parenting_schedule"
      ],
      "note": "The session surfaced these items as unresolved rather than settled."
    },
    {
      "fact_id": "fact-011",
      "category": "communication_history",
      "statement": "Commute timing between residences affects pickup/dropoff feasibility",
      "status": "accepted",
      "source_turns": [
        7
      ],
      "related_issues": [
        "parenting_schedule"
      ],
      "note": null
    },
    {
      "fact_id": "fact-012",
      "category": "communication_history",
      "statement": "Exchange punctuality history is disputed or unestablished",
      "status": "accepted",
      "source_turns": [
        7
      ],
      "related_issues": [
        "parenting_schedule"
      ],
      "note": null
    },
    {
      "fact_id": "fact-013",
      "category": "timeline",
      "statement": "Both parents accept clarification of logistics as the bounded next step.",
      "status": "accepted",
      "source_turns": [
        8
      ],
      "related_issues": [
        "school_logistics",
        "parenting_schedule"
      ],
      "note": null
    }
  ],
  "facts_notes": "Uncertain feasibility items remain explicit rather than being promoted to settled conclusions."
}
