{
  "schema_version": "facts_snapshot.v0",
  "case_id": "D-B03",
  "session_id": "D-B03-S01-generated",
  "facts": [
    {
      "fact_id": "fact-001",
      "category": "communication_history",
      "statement": "Spouse A states they need acknowledgment before they can engage with logistics.",
      "status": "accepted",
      "source_turns": [
        2
      ],
      "related_issues": [
        "process_legitimacy",
        "emotional_acknowledgment"
      ],
      "note": null
    },
    {
      "fact_id": "fact-002",
      "category": "communication_history",
      "statement": "Both parties have stated a preference for an orderly process.",
      "status": "accepted",
      "source_turns": [
        3
      ],
      "related_issues": [
        "process_legitimacy"
      ],
      "note": null
    },
    {
      "fact_id": "fact-003",
      "category": "communication_history",
      "statement": "The emotional weight of the betrayal is present and acknowledged as process-relevant.",
      "status": "accepted",
      "source_turns": [
        3
      ],
      "related_issues": [
        "emotional_acknowledgment"
      ],
      "note": "Recorded as a process-relevant fact. Not a safety signal."
    },
    {
      "fact_id": "fact-004",
      "category": "communication_history",
      "statement": "Spouse B has offered an acknowledgment of the harm caused.",
      "status": "accepted",
      "source_turns": [
        4
      ],
      "related_issues": [
        "emotional_acknowledgment"
      ],
      "note": "Accepted as a process-relevant acknowledgment. Not adjudicating the underlying relational claim."
    },
    {
      "fact_id": "fact-005",
      "category": "family_structure",
      "statement": "Both parties want the children protected and both prefer an orderly process.",
      "status": "accepted",
      "source_turns": [
        5
      ],
      "related_issues": [
        "separation_structure",
        "process_legitimacy"
      ],
      "note": null
    },
    {
      "fact_id": "fact-006",
      "category": "escalation_record",
      "statement": "C9 boundary decision: emotional distress is present and acknowledged. The safety escalation threshold is not reached.",
      "status": "accepted",
      "source_turns": [
        5
      ],
      "related_issues": [
        "process_legitimacy"
      ],
      "note": "Signals observed: emotional_distress_noted, pace_tension. No coercion signal, no incapacity signal, no acute safety indicator. M1 posture is appropriate. M2 is not triggered."
    },
    {
      "fact_id": "fact-007",
      "category": "communication_history",
      "statement": "Spouse A agrees to begin discussing separation structure while reserving the right to return to the acknowledgment dimension.",
      "status": "accepted",
      "source_turns": [
        6
      ],
      "related_issues": [
        "process_legitimacy",
        "separation_structure"
      ],
      "note": null
    },
    {
      "fact_id": "fact-008",
      "category": "family_structure",
      "statement": "Both parties identify minimising required joint decisions as the key structural preference.",
      "status": "accepted",
      "source_turns": [
        6
      ],
      "related_issues": [
        "separation_structure"
      ],
      "note": null
    },
    {
      "fact_id": "fact-009",
      "category": "timeline",
      "statement": "Both parties accept the low-contact separation structure as a starting working basis.",
      "status": "accepted",
      "source_turns": [
        8
      ],
      "related_issues": [
        "separation_structure"
      ],
      "note": null
    }
  ],
  "facts_notes": "Facts remain separated from unresolved feasibility questions."
}
