{
  "schema_version": "facts_snapshot.v0",
  "case_id": "D-B-RT05",
  "session_id": "D-B-RT05-S01",
  "facts": [
    {
      "fact_id": "fact-001",
      "category": "communication_history",
      "statement": "Turn 1 information absence is structural, not a gap to resolve within the current turn",
      "status": "accepted",
      "source_turns": [
        1
      ],
      "related_issues": [
        "parenting_schedule"
      ],
      "note": null
    },
    {
      "fact_id": "fact-002",
      "category": "communication_history",
      "statement": "Session framing must precede any substantive domain work",
      "status": "accepted",
      "source_turns": [
        1
      ],
      "related_issues": [
        "parenting_schedule"
      ],
      "note": null
    },
    {
      "fact_id": "fact-003",
      "category": "financial",
      "statement": "Party B's housing costs: $2,400/month (signed lease). No income for six months. No savings.",
      "status": "accepted",
      "source_turns": [
        2
      ],
      "related_issues": [
        "housing_cost_division"
      ],
      "note": null
    },
    {
      "fact_id": "fact-004",
      "category": "financial",
      "statement": "Party A net income: $7,200/month. Party A housing costs: $1,800/month.",
      "status": "accepted",
      "source_turns": [
        2
      ],
      "related_issues": [
        "housing_cost_division"
      ],
      "note": null
    },
    {
      "fact_id": "fact-005",
      "category": "communication_history",
      "statement": "Party B's stated need: $2,400/month \u00d7 6 months = $14,400 total",
      "status": "accepted",
      "source_turns": [
        3
      ],
      "related_issues": [
        "parenting_schedule"
      ],
      "note": null
    },
    {
      "fact_id": "fact-006",
      "category": "communication_history",
      "statement": "Party B's timeline: immediate need, six-month duration tied to retraining completion",
      "status": "accepted",
      "source_turns": [
        3
      ],
      "related_issues": [
        "parenting_schedule"
      ],
      "note": null
    },
    {
      "fact_id": "fact-007",
      "category": "communication_history",
      "statement": "Party B's stated $2,400/month need based on signed lease",
      "status": "accepted",
      "source_turns": [
        5
      ],
      "related_issues": [
        "parenting_schedule"
      ],
      "note": null
    },
    {
      "fact_id": "fact-008",
      "category": "communication_history",
      "statement": "Party A's proposed $1,800/month as sustainable contribution level",
      "status": "accepted",
      "source_turns": [
        5
      ],
      "related_issues": [
        "parenting_schedule"
      ],
      "note": null
    },
    {
      "fact_id": "fact-009",
      "category": "communication_history",
      "statement": "Party B stated $2,400/month housing cost (signed lease) and zero income for six months",
      "status": "accepted",
      "source_turns": [
        7
      ],
      "related_issues": [
        "parenting_schedule"
      ],
      "note": null
    },
    {
      "fact_id": "fact-010",
      "category": "communication_history",
      "statement": "Party A proposed $1,800/month",
      "status": "accepted",
      "source_turns": [
        7
      ],
      "related_issues": [
        "parenting_schedule"
      ],
      "note": null
    },
    {
      "fact_id": "fact-011",
      "category": "financial",
      "statement": "Party B's actual need confirmed as $2,400/month. T6 acceptance of $1,800 was structural compliance, not a genuine position update.",
      "status": "accepted",
      "source_turns": [
        8
      ],
      "related_issues": [
        "housing_cost_division"
      ],
      "note": null
    }
  ],
  "facts_notes": "Facts remain separated from unresolved feasibility questions."
}
