{
  "schema_version": "facts_snapshot.v0",
  "case_id": "D-B07",
  "session_id": "D-B07-S11",
  "facts": [
    {
      "fact_id": "fact-001",
      "category": "communication_history",
      "statement": "Session framing phase \u2014 substantive issue work has not begun",
      "status": "accepted",
      "source_turns": [
        1
      ],
      "related_issues": [
        "parenting_schedule"
      ],
      "note": null
    },
    {
      "fact_id": "fact-002",
      "category": "communication_history",
      "statement": "No dispute content articulated yet",
      "status": "accepted",
      "source_turns": [
        1
      ],
      "related_issues": [
        "parenting_schedule"
      ],
      "note": null
    },
    {
      "fact_id": "fact-003",
      "category": "communication_history",
      "statement": "Turn 3 of info_gathering phase \u2014 only one party has spoken once",
      "status": "accepted",
      "source_turns": [
        3
      ],
      "related_issues": [
        "parenting_schedule"
      ],
      "note": null
    },
    {
      "fact_id": "fact-004",
      "category": "communication_history",
      "statement": "Party A's concern is procedural (timing, documentation, notice) not substantive (amount, necessity, fairness of underlying expenses)",
      "status": "accepted",
      "source_turns": [
        3
      ],
      "related_issues": [
        "parenting_schedule"
      ],
      "note": null
    },
    {
      "fact_id": "fact-005",
      "category": "communication_history",
      "statement": "Balance between accountability (documentation, timing) and workability (reasonable flexibility, shared control)",
      "status": "accepted",
      "source_turns": [
        5
      ],
      "related_issues": [
        "parenting_schedule"
      ],
      "note": null
    },
    {
      "fact_id": "fact-006",
      "category": "communication_history",
      "statement": "Need for threshold calibration to parties' financial situation and typical expense patterns \u2014 material gap exists but does not block option qualification",
      "status": "accepted",
      "source_turns": [
        5
      ],
      "related_issues": [
        "parenting_schedule"
      ],
      "note": null
    }
  ],
  "facts_notes": "Facts remain separated from unresolved feasibility questions."
}
