{
  "schema_version": "facts_snapshot.v0",
  "case_id": "D-B03",
  "session_id": "D-B03-S02",
  "facts": [
    {
      "fact_id": "fact-001",
      "category": "communication_history",
      "statement": "Session is in opening phase - substantive domain not yet identified",
      "status": "accepted",
      "source_turns": [
        1
      ],
      "related_issues": [
        "parenting_schedule"
      ],
      "note": null
    },
    {
      "fact_id": "fact-002",
      "category": "communication_history",
      "statement": "No information about dispute type (custody, property, support, etc.)",
      "status": "accepted",
      "source_turns": [
        1
      ],
      "related_issues": [
        "parenting_schedule"
      ],
      "note": null
    },
    {
      "fact_id": "fact-003",
      "category": "communication_history",
      "statement": "Spouse A states they need acknowledgment before they can engage with logistics.",
      "status": "accepted",
      "source_turns": [
        2
      ],
      "related_issues": [
        "process_legitimacy",
        "emotional_acknowledgment"
      ],
      "note": null
    },
    {
      "fact_id": "fact-004",
      "category": "communication_history",
      "statement": "Party A has set a boundary condition: acknowledgment before logistics",
      "status": "accepted",
      "source_turns": [
        3
      ],
      "related_issues": [
        "parenting_schedule"
      ],
      "note": null
    },
    {
      "fact_id": "fact-005",
      "category": "communication_history",
      "statement": "Party B has not yet contributed their perspective, interests, or response to Party A's framing",
      "status": "accepted",
      "source_turns": [
        3
      ],
      "related_issues": [
        "parenting_schedule"
      ],
      "note": null
    },
    {
      "fact_id": "fact-006",
      "category": "communication_history",
      "statement": "Spouse B has offered an acknowledgment of the harm caused.",
      "status": "accepted",
      "source_turns": [
        4
      ],
      "related_issues": [
        "emotional_acknowledgment"
      ],
      "note": "Accepted as a process-relevant acknowledgment. Not adjudicating the underlying relational claim."
    },
    {
      "fact_id": "fact-007",
      "category": "family_structure",
      "statement": "Both parties identify the children's need for both parents to be able to function together.",
      "status": "accepted",
      "source_turns": [
        4
      ],
      "related_issues": [
        "separation_structure",
        "process_legitimacy"
      ],
      "note": null
    },
    {
      "fact_id": "fact-008",
      "category": "communication_history",
      "statement": "No substantive issue has been identified \u2014 parties are negotiating process terms, not engaging concrete decisions",
      "status": "accepted",
      "source_turns": [
        5
      ],
      "related_issues": [
        "parenting_schedule"
      ],
      "note": null
    },
    {
      "fact_id": "fact-009",
      "category": "communication_history",
      "statement": "Both parties have set process boundaries that must be acknowledged before issue work can begin",
      "status": "accepted",
      "source_turns": [
        5
      ],
      "related_issues": [
        "parenting_schedule"
      ],
      "note": null
    },
    {
      "fact_id": "fact-010",
      "category": "communication_history",
      "statement": "Spouse A agrees to begin discussing separation structure while reserving the right to return to the acknowledgment dimension.",
      "status": "accepted",
      "source_turns": [
        6
      ],
      "related_issues": [
        "process_legitimacy",
        "separation_structure"
      ],
      "note": null
    },
    {
      "fact_id": "fact-011",
      "category": "family_structure",
      "statement": "Both parties identify minimising required joint decisions as the key structural preference.",
      "status": "accepted",
      "source_turns": [
        6
      ],
      "related_issues": [
        "separation_structure"
      ],
      "note": null
    },
    {
      "fact_id": "fact-012",
      "category": "communication_history",
      "statement": "No specific issue domain has been identified yet \u2014 'separation structure' is too broad for option qualification",
      "status": "accepted",
      "source_turns": [
        7
      ],
      "related_issues": [
        "parenting_schedule"
      ],
      "note": null
    },
    {
      "fact_id": "fact-013",
      "category": "communication_history",
      "statement": "Party A's conditional engagement means option work must not signal that the acknowledgment dimension is closed",
      "status": "accepted",
      "source_turns": [
        7
      ],
      "related_issues": [
        "parenting_schedule"
      ],
      "note": null
    },
    {
      "fact_id": "fact-014",
      "category": "timeline",
      "statement": "Both parties accept the low-contact separation structure as a starting working basis.",
      "status": "accepted",
      "source_turns": [
        8
      ],
      "related_issues": [
        "separation_structure"
      ],
      "note": null
    }
  ],
  "facts_notes": "Facts remain separated from unresolved feasibility questions."
}
