{
  "schema_version": "facts_snapshot.v0",
  "case_id": "D-B-RT06",
  "session_id": "D-B-RT06-S01",
  "facts": [
    {
      "fact_id": "fact-001",
      "category": "communication_history",
      "statement": "No issue domain identified \u2014 cannot apply domain-specific feasibility constraints",
      "status": "accepted",
      "source_turns": [
        1
      ],
      "related_issues": [
        "parenting_schedule"
      ],
      "note": null
    },
    {
      "fact_id": "fact-002",
      "category": "communication_history",
      "statement": "Session is in opening frame \u2014 process structure takes precedence over substantive analysis",
      "status": "accepted",
      "source_turns": [
        1
      ],
      "related_issues": [
        "parenting_schedule"
      ],
      "note": null
    },
    {
      "fact_id": "fact-003",
      "category": "communication_history",
      "statement": "Session stage: Turn 3 \u2014 foundational information gathering not complete",
      "status": "accepted",
      "source_turns": [
        3
      ],
      "related_issues": [
        "parenting_schedule"
      ],
      "note": null
    },
    {
      "fact_id": "fact-004",
      "category": "communication_history",
      "statement": "Only one party partially heard \u2014 Party B has not spoken",
      "status": "accepted",
      "source_turns": [
        3
      ],
      "related_issues": [
        "parenting_schedule"
      ],
      "note": null
    },
    {
      "fact_id": "fact-005",
      "category": "communication_history",
      "statement": "Cannot assess custody option feasibility with only one party's partial interests known",
      "status": "accepted",
      "source_turns": [
        5
      ],
      "related_issues": [
        "parenting_schedule"
      ],
      "note": null
    },
    {
      "fact_id": "fact-006",
      "category": "communication_history",
      "statement": "Week-on-week preference from Party A is surface-level logistical statement without underlying interest articulation",
      "status": "accepted",
      "source_turns": [
        5
      ],
      "related_issues": [
        "parenting_schedule"
      ],
      "note": null
    },
    {
      "fact_id": "fact-007",
      "category": "communication_history",
      "statement": "Fundamental information absence \u2014 Party B has not stated any position, concerns, or interests regarding custody arrangements",
      "status": "accepted",
      "source_turns": [
        7
      ],
      "related_issues": [
        "parenting_schedule"
      ],
      "note": null
    },
    {
      "fact_id": "fact-008",
      "category": "communication_history",
      "statement": "No bilateral engagement has occurred \u2014 all substantive exchange has been Party A addressing mediator",
      "status": "accepted",
      "source_turns": [
        7
      ],
      "related_issues": [
        "parenting_schedule"
      ],
      "note": null
    },
    {
      "fact_id": "fact-009",
      "category": "family_structure",
      "statement": "Party B values specific school-week days (Tue/Thu for homework) over total time. School-week contact is the priority; weekend flexibility available.",
      "status": "accepted",
      "source_turns": [
        8
      ],
      "related_issues": [
        "parenting_schedule"
      ],
      "note": null
    }
  ],
  "facts_notes": "Facts remain separated from unresolved feasibility questions."
}
