{
  "schema_version": "facts_snapshot.v0",
  "case_id": "D-B01",
  "session_id": "D-B01-S02",
  "facts": [
    {
      "fact_id": "fact-001",
      "category": "communication_history",
      "statement": "No issue identification exists yet",
      "status": "accepted",
      "source_turns": [
        1
      ],
      "related_issues": [
        "parenting_schedule"
      ],
      "note": null
    },
    {
      "fact_id": "fact-002",
      "category": "communication_history",
      "statement": "No factual context available",
      "status": "accepted",
      "source_turns": [
        1
      ],
      "related_issues": [
        "parenting_schedule"
      ],
      "note": null
    },
    {
      "fact_id": "fact-003",
      "category": "communication_history",
      "statement": "The current absence of a logistics framework is creating friction and confusion for both parents and the child.",
      "status": "accepted",
      "source_turns": [
        2
      ],
      "related_issues": [
        "communication_protocol",
        "parenting_schedule"
      ],
      "note": null
    },
    {
      "fact_id": "fact-004",
      "category": "communication_history",
      "statement": "structural information gap: Party B has not yet been heard",
      "status": "accepted",
      "source_turns": [
        3
      ],
      "related_issues": [
        "parenting_schedule"
      ],
      "note": null
    },
    {
      "fact_id": "fact-005",
      "category": "communication_history",
      "statement": "Party A has framed the issue around written structure and predictability \u2014 this frame must be tested, not assumed",
      "status": "accepted",
      "source_turns": [
        3
      ],
      "related_issues": [
        "parenting_schedule"
      ],
      "note": null
    },
    {
      "fact_id": "fact-006",
      "category": "family_structure",
      "statement": "Both parents identify child comfort as the common anchor for any logistics framework.",
      "status": "accepted",
      "source_turns": [
        4
      ],
      "related_issues": [
        "parenting_schedule",
        "activity_coordination"
      ],
      "note": null
    },
    {
      "fact_id": "fact-007",
      "category": "communication_history",
      "statement": "Critical logistics parameters remain unknown: current parenting time baseline, geographic proximity, work schedule constraints, child's age",
      "status": "accepted",
      "source_turns": [
        5
      ],
      "related_issues": [
        "parenting_schedule"
      ],
      "note": null
    },
    {
      "fact_id": "fact-008",
      "category": "communication_history",
      "statement": "Problem specificity gap: Party A named 'confusion' but has not provided concrete examples of breakdown",
      "status": "accepted",
      "source_turns": [
        5
      ],
      "related_issues": [
        "parenting_schedule"
      ],
      "note": null
    }
  ],
  "facts_notes": "Facts remain separated from unresolved feasibility questions."
}
