{
  "schema_version": "facts_snapshot.v0",
  "case_id": "D-B08",
  "session_id": "D-B08-S02",
  "facts": [
    {
      "fact_id": "fact-001",
      "category": "communication_history",
      "statement": "Turn 1 session opening - no dispute content has been articulated",
      "status": "accepted",
      "source_turns": [
        1
      ],
      "related_issues": [
        "parenting_schedule"
      ],
      "note": null
    },
    {
      "fact_id": "fact-002",
      "category": "communication_history",
      "statement": "Issue domain completely unidentified - parties have not stated what they are here to resolve",
      "status": "accepted",
      "source_turns": [
        1
      ],
      "related_issues": [
        "parenting_schedule"
      ],
      "note": null
    },
    {
      "fact_id": "fact-003",
      "category": "communication_history",
      "statement": "Fundamental participation gap: Party B has not contributed at all",
      "status": "accepted",
      "source_turns": [
        3
      ],
      "related_issues": [
        "parenting_schedule"
      ],
      "note": null
    },
    {
      "fact_id": "fact-004",
      "category": "communication_history",
      "statement": "Issue domain is undefined: only Party A's framing exists, and it may be self-serving ('confusion' vs. substantive disagreement)",
      "status": "accepted",
      "source_turns": [
        3
      ],
      "related_issues": [
        "parenting_schedule"
      ],
      "note": null
    },
    {
      "fact_id": "fact-005",
      "category": "communication_history",
      "statement": "One parent explicitly reports feeling cut off and doubts that the current process is staying balanced.",
      "status": "accepted",
      "source_turns": [
        4
      ],
      "related_issues": [
        "communication_protocol",
        "fairness_and_parent_role"
      ],
      "note": "This is preserved as a process-relevant report, not an adjudicated conclusion about intent."
    },
    {
      "fact_id": "fact-006",
      "category": "communication_history",
      "statement": "No substantive issue domain has been identified \u2014 we do not know what decisions the parties are here to address",
      "status": "accepted",
      "source_turns": [
        5
      ],
      "related_issues": [
        "parenting_schedule"
      ],
      "note": null
    },
    {
      "fact_id": "fact-007",
      "category": "communication_history",
      "statement": "Party B's substantive interests are entirely unknown",
      "status": "accepted",
      "source_turns": [
        5
      ],
      "related_issues": [
        "parenting_schedule"
      ],
      "note": null
    }
  ],
  "facts_notes": "Facts remain separated from unresolved feasibility questions."
}
