{
  "schema_version": "facts_snapshot.v0",
  "case_id": "D-B-RT02",
  "session_id": "D-B-RT02-S01",
  "facts": [
    {
      "fact_id": "fact-001",
      "category": "communication_history",
      "statement": "No issue content has been introduced yet",
      "status": "accepted",
      "source_turns": [
        1
      ],
      "related_issues": [
        "parenting_schedule"
      ],
      "note": null
    },
    {
      "fact_id": "fact-002",
      "category": "communication_history",
      "statement": "No party positions or interests have been stated",
      "status": "accepted",
      "source_turns": [
        1
      ],
      "related_issues": [
        "parenting_schedule"
      ],
      "note": null
    },
    {
      "fact_id": "fact-003",
      "category": "communication_history",
      "statement": "Critical information vacuum \u2014 asset inventory exists but no understanding of what either party needs, fears, or prioritizes regarding those assets",
      "status": "accepted",
      "source_turns": [
        3
      ],
      "related_issues": [
        "parenting_schedule"
      ],
      "note": null
    },
    {
      "fact_id": "fact-004",
      "category": "communication_history",
      "statement": "Business interest flagged as 'complex' \u2014 likely requires expert valuation and may involve ongoing income, debt, or operational dependencies that affect feasibility of division options",
      "status": "accepted",
      "source_turns": [
        3
      ],
      "related_issues": [
        "parenting_schedule"
      ],
      "note": null
    },
    {
      "fact_id": "fact-005",
      "category": "communication_history",
      "statement": "Party B has provided zero substantive input across four turns \u2014 no perspective, no interests articulated, no response to mediator invitation",
      "status": "accepted",
      "source_turns": [
        5
      ],
      "related_issues": [
        "parenting_schedule"
      ],
      "note": null
    },
    {
      "fact_id": "fact-006",
      "category": "communication_history",
      "statement": "No dispute has been identified \u2014 only asset categories named with no competing positions",
      "status": "accepted",
      "source_turns": [
        5
      ],
      "related_issues": [
        "parenting_schedule"
      ],
      "note": null
    },
    {
      "fact_id": "fact-007",
      "category": "communication_history",
      "statement": "Party B non-participation is now a critical process constraint, not merely a domain information gap \u2014 this blocks all option work because we lack bilateral input",
      "status": "accepted",
      "source_turns": [
        7
      ],
      "related_issues": [
        "parenting_schedule"
      ],
      "note": null
    },
    {
      "fact_id": "fact-008",
      "category": "communication_history",
      "statement": "No specific issues have been identified \u2014 parties are still in narrative/positioning stage, not issue identification",
      "status": "accepted",
      "source_turns": [
        7
      ],
      "related_issues": [
        "parenting_schedule"
      ],
      "note": null
    }
  ],
  "facts_notes": "Facts remain separated from unresolved feasibility questions."
}
