{
  "schema_version": "facts_snapshot.v0",
  "case_id": "D-B04",
  "session_id": "D-B04-S06",
  "facts": [
    {
      "fact_id": "fact-001",
      "category": "communication_history",
      "statement": "Session initialization \u2014 no issue domain identified yet",
      "status": "accepted",
      "source_turns": [
        1
      ],
      "related_issues": [
        "parenting_schedule"
      ],
      "note": null
    },
    {
      "fact_id": "fact-002",
      "category": "communication_history",
      "statement": "No party positions or interests articulated",
      "status": "accepted",
      "source_turns": [
        1
      ],
      "related_issues": [
        "parenting_schedule"
      ],
      "note": null
    },
    {
      "fact_id": "fact-003",
      "category": "parenting_schedule",
      "statement": "There is an active dispute about school-night overnights.",
      "status": "accepted",
      "source_turns": [
        2
      ],
      "related_issues": [
        "parenting_schedule"
      ],
      "note": null
    },
    {
      "fact_id": "fact-004",
      "category": "family_structure",
      "statement": "The child has school-related routine needs that both parents recognize as important.",
      "status": "accepted",
      "source_turns": [
        2
      ],
      "related_issues": [
        "parenting_schedule",
        "school_logistics"
      ],
      "note": null
    },
    {
      "fact_id": "fact-005",
      "category": "communication_history",
      "statement": "STRUCTURAL: Party B has not spoken \u2014 this is not an information gap about logistics, it is the absence of a required stakeholder voice",
      "status": "accepted",
      "source_turns": [
        3
      ],
      "related_issues": [
        "parenting_schedule"
      ],
      "note": null
    },
    {
      "fact_id": "fact-006",
      "category": "communication_history",
      "statement": "PROCEDURAL: Standard mediation practice requires both parties' opening statements before problem-solving",
      "status": "accepted",
      "source_turns": [
        3
      ],
      "related_issues": [
        "parenting_schedule"
      ],
      "note": null
    },
    {
      "fact_id": "fact-007",
      "category": "family_structure",
      "statement": "Parent B links school-week overnights to meaningful parenting-role concerns.",
      "status": "accepted",
      "source_turns": [
        4
      ],
      "related_issues": [
        "fairness_and_parent_role",
        "parenting_schedule"
      ],
      "note": "Accepted as a stated process-relevant concern, not as an adjudicated conclusion about intent."
    },
    {
      "fact_id": "fact-008",
      "category": "communication_history",
      "statement": "Cannot assess feasibility of any structural option (gradual expansion, midweek visits, transition protocols) without knowing current baseline schedule",
      "status": "accepted",
      "source_turns": [
        5
      ],
      "related_issues": [
        "parenting_schedule"
      ],
      "note": null
    },
    {
      "fact_id": "fact-009",
      "category": "communication_history",
      "statement": "Child's age/stage determines what overnight frequency and transition patterns are developmentally appropriate",
      "status": "accepted",
      "source_turns": [
        5
      ],
      "related_issues": [
        "parenting_schedule"
      ],
      "note": null
    },
    {
      "fact_id": "fact-010",
      "category": "timeline",
      "statement": "Transport, exchange timing, and homework-routine reliability remain unresolved for school-week overnights.",
      "status": "uncertain",
      "source_turns": [
        6
      ],
      "related_issues": [
        "school_logistics",
        "parenting_schedule"
      ],
      "note": "The session surfaced these items as unresolved rather than settled."
    },
    {
      "fact_id": "fact-011",
      "category": "communication_history",
      "statement": "Commute timing feasibility (moderate gap \u2014 no specifics on distance or current logistics)",
      "status": "accepted",
      "source_turns": [
        7
      ],
      "related_issues": [
        "parenting_schedule"
      ],
      "note": null
    },
    {
      "fact_id": "fact-012",
      "category": "communication_history",
      "statement": "Exchange punctuality as trust/reliability proxy (both parties named this)",
      "status": "accepted",
      "source_turns": [
        7
      ],
      "related_issues": [
        "parenting_schedule"
      ],
      "note": null
    },
    {
      "fact_id": "fact-013",
      "category": "timeline",
      "statement": "Both parents accept clarification of logistics as the bounded next step.",
      "status": "accepted",
      "source_turns": [
        8
      ],
      "related_issues": [
        "school_logistics",
        "parenting_schedule"
      ],
      "note": null
    }
  ],
  "facts_notes": "Uncertain feasibility items remain explicit rather than being promoted to settled conclusions."
}
