{
  "schema_version": "facts_snapshot.v0",
  "case_id": "D-B14",
  "session_id": "D-B14-S02",
  "facts": [
    {
      "fact_id": "fact-001",
      "category": "communication_history",
      "statement": "Session opening \u2014 no issue domain identified",
      "status": "accepted",
      "source_turns": [
        1
      ],
      "related_issues": [
        "parenting_schedule"
      ],
      "note": null
    },
    {
      "fact_id": "fact-002",
      "category": "communication_history",
      "statement": "No positions or interests articulated by either party",
      "status": "accepted",
      "source_turns": [
        1
      ],
      "related_issues": [
        "parenting_schedule"
      ],
      "note": null
    },
    {
      "fact_id": "fact-003",
      "category": "communication_history",
      "statement": "One parent reports being too exhausted and cognitively scattered to track the discussion reliably.",
      "status": "accepted",
      "source_turns": [
        2
      ],
      "related_issues": [
        "communication_protocol",
        "fairness_and_parent_role"
      ],
      "note": null
    },
    {
      "fact_id": "fact-004",
      "category": "communication_history",
      "statement": "CRITICAL: Party A has explicitly stated participation incapacity \u2014 they cannot make steady decisions about parenting today",
      "status": "accepted",
      "source_turns": [
        3
      ],
      "related_issues": [
        "parenting_schedule"
      ],
      "note": null
    },
    {
      "fact_id": "fact-005",
      "category": "communication_history",
      "statement": "CRITICAL: Parenting disputes involve children's welfare \u2014 the stakes for error are elevated beyond typical property or financial matters",
      "status": "accepted",
      "source_turns": [
        3
      ],
      "related_issues": [
        "parenting_schedule"
      ],
      "note": null
    },
    {
      "fact_id": "fact-006",
      "category": "communication_history",
      "statement": "The concern about participation capacity remains active after direct clarification and is now affecting whether any apparent agreement would be reliable.",
      "status": "accepted",
      "source_turns": [
        4
      ],
      "related_issues": [
        "communication_protocol",
        "fairness_and_parent_role"
      ],
      "note": null
    },
    {
      "fact_id": "fact-007",
      "category": "communication_history",
      "statement": "Party A cognitive incapacity for high-stakes parenting decisions \u2014 unresolved and worsening",
      "status": "accepted",
      "source_turns": [
        5
      ],
      "related_issues": [
        "parenting_schedule"
      ],
      "note": null
    },
    {
      "fact_id": "fact-008",
      "category": "communication_history",
      "statement": "Party B timeline pressure \u2014 nature and source unknown",
      "status": "accepted",
      "source_turns": [
        5
      ],
      "related_issues": [
        "parenting_schedule"
      ],
      "note": null
    }
  ],
  "facts_notes": "Facts remain separated from unresolved feasibility questions."
}
